<?xml version="1.0" encoding="UTF-8"?>
<dataroot xmlns:od="urn:schemas-microsoft-com:officedata" xmlns:xsi="http://www.w3.org/2001/XMLSchema-instance"  xsi:noNamespaceSchemaLocation="WeaponLowerClassName.xsd" generated="2017-08-25T14:36:22">
<WeaponLowerClassName>
<ID>1</ID>
<GivenID>0</GivenID>
<WeaponLowerClass>Sword</WeaponLowerClass>
</WeaponLowerClassName>
<WeaponLowerClassName>
<ID>2</ID>
<GivenID>1</GivenID>
<WeaponLowerClass>Mace</WeaponLowerClass>
</WeaponLowerClassName>
<WeaponLowerClassName>
<ID>3</ID>
<GivenID>2</GivenID>
<WeaponLowerClass>Axe</WeaponLowerClass>
</WeaponLowerClassName>
<WeaponLowerClassName>
<ID>4</ID>
<GivenID>3</GivenID>
<WeaponLowerClass>Claw</WeaponLowerClass>
</WeaponLowerClassName>
<WeaponLowerClassName>
<ID>5</ID>
<GivenID>4</GivenID>
<WeaponLowerClass>Dagger</WeaponLowerClass>
</WeaponLowerClassName>
<WeaponLowerClassName>
<ID>6</ID>
<GivenID>5</GivenID>
<WeaponLowerClass>Bow</WeaponLowerClass>
</WeaponLowerClassName>
<WeaponLowerClassName>
<ID>7</ID>
<GivenID>6</GivenID>
<WeaponLowerClass>Wand</WeaponLowerClass>
</WeaponLowerClassName>
</dataroot>
